{
  "schemaVersion": 1,
  "stackVersion": "0.1.0-candidate.10",
  "channel": "candidate",
  "releasedAt": "2026-08-21T09:55:00Z",
  "minimumSlabctlVersion": "0.1.0-candidate.10",
  "images": {
    "agents": {
      "ref": "ghcr.io/martin2844/slab-agents:candidate-2cacde16f607d1a1850bc7e7f52ffc7ef3ae9cfb",
      "digest": "sha256:ac2ce49d2c4a7b175f3e276954bbb462f722718bfb12d1e6aeeb9aa9f1adfce3",
      "platforms": ["linux/amd64", "linux/arm64"]
    },
    "work": {
      "ref": "ghcr.io/martin2844/slab:candidate-bbafc81d62b2f429b3af1e8972a338f5276e0f7a",
      "digest": "sha256:3190a68db66331027605dec6f07dfd12565b0ed9132d518b25367609edf1cfc5",
      "platforms": ["linux/amd64", "linux/arm64"]
    },
    "docs": {
      "ref": "ghcr.io/martin2844/slab-docs:candidate-1e2e6ed9ca2257a393e63e3219648471a63d480c",
      "digest": "sha256:0521012b5465e92192699eb13a13826f07739995531e1a963c8e09db25a7d59a",
      "platforms": ["linux/amd64", "linux/arm64"]
    },
    "email": {
      "ref": "ghcr.io/martin2844/slab-email:candidate-58816f1d708c97953ed5c4f87b81170c6a9ba1e0",
      "digest": "sha256:95e165cf4be802ce8bf5266d4573d7328f721aee77bca300c20d37cd0cb82d6f",
      "platforms": ["linux/amd64", "linux/arm64"]
    },
    "runner": {
      "ref": "ghcr.io/martin2844/slab-runner:candidate-d8a85a67ee66036a2f5f662a2aa3adc060d5511b",
      "digest": "sha256:7cd7c1da0aa14a710c7b9c2ac59e16679e3a684513b78da6e22dc7976d078377",
      "platforms": ["linux/amd64", "linux/arm64"]
    }
  },
  "codexVersion": "0.148.0",
  "migrationCompatibility": {
    "minimumUpgradeStack": "0.1.0-candidate.1",
    "minimumRollbackStack": "0.1.0-candidate.4"
  }
}
